claim_id,claim,current_class,closest_prior_art,remaining_open_scope
C24,Disorder and Cd-composition fluctuations can renormalize the HgCdTe Kane mass and induce an inversion transition,established,"Krishtopenko Antezza Teppe 2022 SCBA","Joint finite-temperature electron-phonon and disorder treatment"
C25,Use unfolded spectral weight to analyze disordered HgCdTe band crossover,established,"Rubel et al. 2014 supercell unfolding","Temperature dependence configuration covariance and experimental width validation"
C26,Report a mean signed gap together with a disorder or spectral width near inversion,incremental methodological,"SCBA density of states and unfolded spectra establish the need for spectral information","Common operational width definition and held-out HgCdTe validation"
C27,Project combined electron-phonon and disorder matrix self-energies into the complete eight-band Kane invariant set,candidate novel unconfirmed,"Matrix AHC and matrix disorder self-energy exist separately","Direct prior-art search and actual calculation"
C28,Estimate ideal random-alloy local gap-sign probability from binomial composition statistics,derived standard statistics,"Random-alloy composition fluctuations are established","Physical coarse-graining scale correlations and comparison with atomistic configurations"
C29,Use Rg=abs(mean gap)/(sum of edge half-widths) as an operational scalar-gap resolution diagnostic,candidate methodological heuristic,"Spectral-overlap reasoning and disorder-averaged Green functions","Calibration against spectral functions optical edges and experimental resolution"
C30,Derive a composition-and-temperature analytical law for both mean HgCdTe gap and spectral width,candidate result,"Mean-gap equations and disorder spectral treatments exist separately","Specimen-level width data and held-out validation"
